{
  "schema_version": "0.4.0",
  "id": "91a10008-0003-4000-8000-000000000008",
  "project_id": "11111111-1111-4111-8111-111111111111",
  "created_at": "2026-08-18T03:00:00Z",
  "created_by": "主编",
  "scene_id": "91a10008-0002-4000-8000-000000000008",
  "status": "Written",
  "location": "青石镇河滩",
  "present_entities": [
    "林晚",
    "残玉"
  ],
  "generation_boundary": "只写林晚过河滩并留下残玉微光伏笔，不写整章。",
  "forbidden": [
    "禁止写出残玉来历"
  ],
  "knowledge_boundaries": [
    "林晚不知残玉能开门"
  ]
}
