{
  "schema_version": "0.4.0",
  "id": "91a10006-0003-4000-8000-000000000006",
  "project_id": "11111111-1111-4111-8111-111111111111",
  "created_at": "2026-08-18T03:00:00Z",
  "created_by": "主编",
  "scene_id": "91a10006-0002-4000-8000-000000000006",
  "status": "Written",
  "location": "青石镇河滩",
  "present_entities": [
    "林晚"
  ],
  "generation_boundary": "只写林晚步行过河滩这一场，不写整章。",
  "forbidden": [
    "禁止凡人施展御空术"
  ],
  "knowledge_boundaries": [
    "林晚不知残玉能开门"
  ]
}
